{
  "schema_version": "1.0.0",
  "protocol_version": "1.0.0",
  "knowledge_version": "none",
  "task_id": "SYN-TASK-1",
  "race_id": "20000101-01-01",
  "evidence_id": "SYN-EV-1",
  "locked_at": "2000-01-01T14:45:00+09:00",
  "synthetic": true,
  "prediction_id": "SYN-PRED-UNAV",
  "status": "UNAVAILABLE",
  "unavailable_reason": "SYNTHETIC: race cancelled"
}
